city,cost,country,county,facility_type,first_shipment,last_shipment,number_of_deliveries,recipient_Name,state,weight_lbs
Goleta,$109.02,US,Santa Barbara County,Free Clinic,Fri Mar 27 2020,Fri Mar 27 2020,1,Network Medical,CA,25.0
Vancouver,$109.02,US,Clark County,Free Clinic,Thu Mar 26 2020,Thu Mar 26 2020,1,New Heights Clinic,WA,25.0
Southport,$109.27,US,Brunswick County,Free Clinic,Thu Mar 26 2020,Thu Mar 26 2020,1,New Hope Clinic,NC,25.0
Greenville,$109.27,US,Greenville County,FQHC/Look-Alike,Thu Mar 26 2020,Thu Mar 26 2020,1,New Horizon Family Health Services,SC,25.0
Bolingbrook,$109.01,US,Will County,Community Clinic,Mon Apr 06 2020,Mon Apr 06 2020,1,New Song Health Center dba Bolinbrook Christian Health Center,IL,25.0
Randalls Island,$736.05,US,New York County,Unknown,Thu Apr 02 2020,Thu Apr 02 2020,1,New York Fire Department - NYC EMS FDNY Fire Academy,NY,235.0
Newark,$109.03,US,Essex County,FQHC/Look-Alike,Wed Apr 01 2020,Wed Apr 01 2020,1,Newark Community Health Centers Corporate Office,NJ,25.0
Owingsville,$109.26,US,Bath County,Free Clinic,Tue Mar 24 2020,Tue Mar 24 2020,1,NewHope Clinic,KY,30.0
Brooklyn,"$11,125.37",US,Kings County,Nonprofit Hospital,Thu Apr 16 2020,Thu Apr 16 2020,1,NewYork-Presbyterian Brooklyn Methodist Hospital,NY,470.0
Garden Grove,"$1,348.91",US,Orange County,FQHC/Look-Alike,Sat Apr 04 2020,Mon May 04 2020,3,Nhan Hoa Comprehensive Health Care Clinic,CA,303.0
New Orleans,"$3,451.71",US,Orleans Parish,FQHC/Look-Alike,Tue Mar 24 2020,Tue Apr 14 2020,3,No Aids Task Force DBA Crescent Care,LA,44.0
Scottsdale,$109.27,US,Maricopa County,FQHC/Look-Alike,Tue Mar 24 2020,Tue Mar 24 2020,1,NOAH - Neighborhood Outreach Access to Health,AZ,25.0
Portland,$109.26,US,Multnomah County,FQHC/Look-Alike,Tue Mar 24 2020,Tue Mar 24 2020,1,North by Northeast Community Health Center,OR,25.0
Delphi,"$1,095.85",US,Carroll County,Community Clinic,Tue May 05 2020,Tue May 05 2020,1,"North Central Nursing Clinics DBA Family Health Clinics of Bulington, Carroll County, and Monon",IN,210.0
San Marcos,$109.27,US,San Diego County,FQHC/Look-Alike,Wed Mar 25 2020,Wed Mar 25 2020,1,North County Health Services,CA,25.0
Oceanside,$144.05,US,San Diego County,Community Clinic,Fri Apr 24 2020,Fri Apr 24 2020,1,North County Health Services Mission Mesa Pediatrics,CA,65.0
Dallas,$253.32,US,Dallas County,Free Clinic,Thu Mar 26 2020,Fri Apr 24 2020,2,North Dallas Shared Ministries Free Medical Clinic,TX,90.0
Daly City,"$3,965.26",US,San Mateo County,FQHC/Look-Alike,Tue Jan 28 2020,Tue Jan 28 2020,1,North East Medical Services,CA,230.0
Boston,$109.26,US,Suffolk County,FQHC/Look-Alike,Tue Mar 24 2020,Tue Mar 24 2020,1,North End Community Health Committee,MA,25.0
Tallahassee,$109.27,US,Leon County,FQHC/Look-Alike,Tue Mar 24 2020,Tue Mar 24 2020,1,"North Florida Medical Centers, Inc.",FL,25.0
Gainesville,"$9,891.71",US,Alachua County,Unknown,Tue May 05 2020,Tue May 05 2020,2,North Florida South Georgia Veteran's Administration Hospital,FL,181.0
North Hills,"$1,095.85",US,Los Angeles County,FQHC/Look-Alike,Mon May 04 2020,Mon May 04 2020,1,North Hills Wellness Center,CA,115.0
Union City,$633.60,US,Hudson County,FQHC/Look-Alike,Tue Mar 24 2020,Fri Apr 24 2020,2,North Hudson Community Action Corporation - Administration,NJ,189.0
Beaumont,$109.01,US,Jefferson County,Public Health Department,Sat Apr 04 2020,Sat Apr 04 2020,1,North Jefferson County Clinic Pharmacy,TX,25.0
North Miami Beach,"$1,834.27",US,Miami-Dade County,Free Clinic,Tue Mar 24 2020,Mon May 04 2020,2,North Miami Beach Medical Center Mercy Mobile Clinic,FL,38.0
Ashland,"$1,205.11",US,Benton County,FQHC/Look-Alike,Tue Mar 24 2020,Tue May 05 2020,2,North Mississippi Primary Health Care Inc.,MS,235.0
Fullerton,$633.60,US,Orange County,FQHC/Look-Alike,Wed Mar 25 2020,Mon Apr 27 2020,2,North Orange County Regional Health Foundation,CA,185.0
Alhambra,$666.00,US,,FQHC/Look-Alike,Wed Apr 01 2020,Wed Apr 01 2020,1,Northeast Community Clinic,CA,197.0
Deland,$109.26,US,Volusia County,FQHC/Look-Alike,Tue Mar 24 2020,Tue Mar 24 2020,1,Northeast Florida Health Services Family Health Source,FL,25.0
Byhalia,$109.27,US,Marshall County,FQHC/Look-Alike,Tue Mar 24 2020,Tue Mar 24 2020,1,"Northeast Mississippi Health Care, Inc.",MS,25.0
Kirksville,$109.03,US,Adair County,FQHC/Look-Alike,Fri Apr 03 2020,Fri Apr 03 2020,1,Northeast Missouri Health Council Inc.,MO,25.0
San Fernando,$144.05,US,Los Angeles County,FQHC/Look-Alike,Tue Apr 28 2020,Tue Apr 28 2020,1,Northeast Valley Health Corporation,CA,63.0
San Fernando,$666.00,US,Los Angeles County,FQHC/Look-Alike,Wed Apr 01 2020,Wed Apr 01 2020,1,Northeast Valley Health Corporation Corporate Office,CA,171.0
San Fernando,$109.27,US,Los Angeles County,FQHC/Look-Alike,Thu Mar 26 2020,Thu Mar 26 2020,1,Northeast Valley Health Corporation San Fernando Health Center,CA,25.0
Hulbert,$109.02,US,Cherokee County,FQHC/Look-Alike,Thu Mar 26 2020,Thu Mar 26 2020,1,"Northeastern Oklahoma Community Health Centers, Inc.",OK,25.0
Lakewood,$109.02,US,Oconto County,FQHC/Look-Alike,Fri Mar 27 2020,Fri Mar 27 2020,1,"Northern Health Centers, Inc.",WI,25.0
Kilmarnock,$109.02,US,Northumberland County,Free Clinic,Thu Mar 26 2020,Thu Mar 26 2020,1,Northern Neck Free Health Clinic Pharmacy,VA,25.0
Reno,$109.02,US,Washoe County,FQHC/Look-Alike,Thu Mar 26 2020,Thu Mar 26 2020,1,Northern Nevada HOPES Clinic,NV,25.0
Iron River,"$1,204.88",US,Bayfield County,FQHC/Look-Alike,Fri Apr 03 2020,Mon May 04 2020,2,NorthLakes Community Clinic,WI,235.0
Turtle Lake,"$1,205.12",US,McLean County,FQHC/Look-Alike,Tue Mar 24 2020,Tue May 05 2020,2,Northland Community Health Center Administration,ND,235.0
Portage,"$1,205.12",US,Porter County,FQHC/Look-Alike,Tue Mar 24 2020,Mon May 04 2020,2,NorthShore Health Centers,IN,235.0
Richmond,"$1,205.12",US,Henrico County,FQHC/Look-Alike,Thu Mar 26 2020,Mon May 04 2020,2,Northside Medical Center,VA,140.0
Libby,$109.27,US,Lincoln County,FQHC/Look-Alike,Thu Mar 26 2020,Thu Mar 26 2020,1,Northwest Community Health Center,MT,25.0
Houston,"$5,544.20",US,Harris County,Unknown,Fri Apr 24 2020,Fri Apr 24 2020,1,Northwest Fire Department,TX,53.0
St. Joseph,"$1,208.42",US,Buchanan County,FQHC/Look-Alike,Thu Mar 26 2020,Mon May 04 2020,3,"Northwest Health Services, Inc.",MO,241.0
Traverse City,"$1,205.12",US,,FQHC/Look-Alike,Tue Mar 24 2020,Mon May 04 2020,2,"Northwest Michigan Health Services, Inc. Traverse City Clinic",MI,140.0
Falls Church,"$1,205.11",US,Fairfax County,Charitable Pharmacy,Tue Mar 24 2020,Mon May 04 2020,2,Nova Scripts Central Inc Pharmacy,VA,140.0
San Juan,$109.27,US,Hidalgo County,FQHC/Look-Alike,Tue Mar 24 2020,Tue Mar 24 2020,1,Nuestra Clinica Del Valle,TX,25.0
Edcouch,$666.00,US,Hidalgo County,FQHC/Look-Alike,Thu Apr 02 2020,Thu Apr 02 2020,1,Nuestra Clinica Del Valle Edcouch Clinic,TX,175.0
New York,"$513,392.90",US,New York County,Hospital,Mon Mar 30 2020,Wed Apr 22 2020,37,NYC Health + Hospitals Bellevue Hospital Incident Command Center,NY,1947.0
New Hyde Park,"$1,469.12",US,Nassau County,Nonprofit Hospital,Mon Apr 13 2020,Tue Apr 14 2020,2,NYU Langone Health,NY,187.0
Stone Mountain,$109.02,US,Dekalb County,FQHC/Look-Alike,Fri Mar 27 2020,Fri Mar 27 2020,1,Oakhurst Medical Center,GA,25.0
Brooklyn,$770.82,US,Kings County,FQHC/Look-Alike,Thu Mar 19 2020,Fri Mar 20 2020,2,ODA Primary Care Health Center,NY,57.0
Williamsburg,$109.02,US,James City County,Other,Thu Mar 26 2020,Thu Mar 26 2020,1,Olde Towne Medical and Dental Center,VA,25.0
Wasco,$633.60,US,Kern County,FQHC/Look-Alike,Tue Mar 24 2020,Mon Apr 27 2020,2,Omni Family Health,CA,218.0
Omaha,$109.27,US,Douglas County,FQHC/Look-Alike,Thu Mar 26 2020,Thu Mar 26 2020,1,OneWorld Community Health Center,NE,25.0
Toccoa,$109.27,US,Stephens County,Free Clinic,Tue Mar 24 2020,Tue Mar 24 2020,1,Open Arms Clinic,GA,25.0
Arlington,$253.31,US,Tarrant County,Free Clinic,Tue Mar 24 2020,Mon Apr 27 2020,2,Open Arms Health Clinic,TX,90.0
Colorado Springs,$109.02,US,El Paso County,Free Clinic,Thu Mar 26 2020,Thu Mar 26 2020,1,Open Bible Medical Clinic and Pharmacy,CO,25.0
Burlington,$109.26,US,Alamance County,Free Clinic,Tue Mar 24 2020,Tue Mar 24 2020,1,Open Door Clinic of Alamance County,NC,25.0
Ossining,$633.36,US,Westchester County,FQHC/Look-Alike,Fri Apr 03 2020,Mon Apr 27 2020,2,Open Door Family Medical Centers Inc.,NY,175.0
Homestead,"$2,409.26",US,Miami-Dade County,Free Clinic,Tue Mar 24 2020,Mon May 04 2020,2,Open Door Health Center,FL,39.0
Ellensburg,$109.27,US,Kittitas County,Free Clinic,Thu Mar 26 2020,Thu Mar 26 2020,1,Open Door Health Clinic,WA,25.0
Raleigh,"$1,205.11",US,Wake County,Free Clinic,Tue Mar 24 2020,Tue May 05 2020,2,Open Door Urban Ministries of Wake County,NC,235.0
Orange,$109.27,US,Orange County,Free Clinic,Tue Mar 24 2020,Tue Mar 24 2020,1,Orange County Free Clinic,VA,25.0
Gridley,"$3,580.23",US,Butte County,Hospital,Wed Apr 01 2020,Wed Apr 01 2020,1,Orchard Hospital,CA,362.0
Chisago City,$109.26,US,Chisago County,Community Clinic,Tue Mar 24 2020,Tue Mar 24 2020,1,Outlook Health Services,MN,25.0
Milwaukee,$109.26,US,Milwaukee County,FQHC/Look-Alike,Tue Mar 24 2020,Tue Mar 24 2020,1,Outreach Community Health Centers,WI,25.0
Shubuta,$109.27,US,Clarke County,FQHC/Look-Alike,Tue Mar 24 2020,Tue Mar 24 2020,1,"Outreach Health Services, Inc.",MS,25.0
Portland,$109.27,US,Multnomah County,FQHC/Look-Alike,Thu Mar 26 2020,Thu Mar 26 2020,1,Outside In,OR,25.0
Oxnard,"$3,484.28",US,Ventura County,Unknown,Thu Apr 16 2020,Thu Apr 16 2020,1,Oxnard College Dental Hygiene Program,CA,73.0
Mobile,$109.02,US,Mobile County,Charitable Pharmacy,Thu Mar 26 2020,Thu Mar 26 2020,1,Ozanam Charitable Pharmacy,AL,25.0
Terre Haute,"$1,095.85",US,Vigo County,Other,Mon May 04 2020,Mon May 04 2020,1,PACE Community Action Agency Health Department Vigo County,IN,115.0
Chicago,$109.28,US,Cook County,Free Clinic,Tue Mar 24 2020,Tue Mar 24 2020,1,Pacific Garden Mission,IL,25.0
Palmetto,$109.28,US,Fulton County,FQHC/Look-Alike,Wed Mar 25 2020,Wed Mar 25 2020,1,"Palmetto Health Council, Inc.",GA,25.0
High Springs,$109.26,US,Alachua County,FQHC/Look-Alike,Tue Mar 24 2020,Tue Mar 24 2020,1,Palms Medical Group,FL,25.0
Panama City,$109.26,US,Bay County,FQHC/Look-Alike,Tue Mar 24 2020,Tue Mar 24 2020,1,"Pancare of Florida, Inc.",FL,25.0
National City,"$4,770.35",US,San Diego County,Hospital,Fri Mar 27 2020,Fri Mar 27 2020,1,Paradise Valley Hospital,CA,609.0
Louisville,$109.02,US,Jefferson County,FQHC/Look-Alike,Thu Mar 26 2020,Thu Mar 26 2020,1,Park Duvalle Community Health Center,KY,25.0
Tullahoma,$109.26,US,Coffee County,Free Clinic,Tue Mar 24 2020,Tue Mar 24 2020,1,Partners For Healing,TN,25.0
Somerville,"$26,839.30",US,Berkshire County,Unknown,Fri Apr 17 2020,Thu Apr 23 2020,2,Partners Healthcare,MA,1112.0
Appleton,"$1,205.11",US,Outagamie County,FQHC/Look-Alike,Tue Mar 24 2020,Tue May 05 2020,2,Partnership Community Health Center Appleton Site,WI,235.0
Pasadena,"$3,508.61",US,Harris County,FQHC/Look-Alike,Tue Mar 24 2020,Mon May 04 2020,3,Pasadena Health Center,TX,202.0
Santa Barbara,"$8,984.22",US,Santa Barbara County,Social Services,Mon Apr 13 2020,Thu Apr 16 2020,2,PathPoint,CA,239.0
Clinton,$264.00,US,East Feliciana Parish,Unknown,Tue Mar 24 2020,Tue Mar 24 2020,1,PCPFHF Warehouse,LA,10.0
Marysville,$109.02,US,Yuba County,FQHC/Look-Alike,Mon Apr 27 2020,Mon Apr 27 2020,1,Peach Tree Healthcare,CA,25.0
Lewisville,$109.26,US,Denton County,Other,Tue Mar 24 2020,Tue Mar 24 2020,1,PediPlace,TX,25.0
Bremerton,"$4,254.47",US,Kitsap County,FQHC/Look-Alike,Tue Mar 24 2020,Tue May 05 2020,3,Peninsula Community Health Services,WA,521.0
Penn Yan,"$1,349.16",US,Yates County,FQHC/Look-Alike,Tue Mar 24 2020,Mon May 04 2020,3,Penn Yan Community Health,NY,203.0
Waterloo,$109.02,US,Black Hawk County,FQHC/Look-Alike,Thu Mar 26 2020,Thu Mar 26 2020,1,Peoples Community Health Clinic,IA,25.0
Park City,$109.26,US,Summit County,Free Clinic,Tue Mar 24 2020,Tue Mar 24 2020,1,People's Health Clinic,UT,25.0
Roxboro,$109.27,US,Person County,FQHC/Look-Alike,Thu Mar 26 2020,Thu Mar 26 2020,1,Person Family Medical Center,NC,25.0
Petaluma,"$2,409.02",US,Sonoma County,FQHC/Look-Alike,Thu Mar 26 2020,Wed Apr 22 2020,2,Petaluma Health Center,CA,45.0
Philadelphia,$109.26,US,Philadelphia County,FQHC/Look-Alike,Tue Mar 24 2020,Tue Mar 24 2020,1,Philadelphia Department of Health Health Care Center #2,PA,25.0
Pittsburgh,$109.27,US,Allegheny County,Community Clinic,Tue Mar 24 2020,Tue Mar 24 2020,1,Pittsburgh Mercy Family Health Center,PA,25.0
Santa Barbara,"$1,885.00",US,Santa Barbara County,Women's Health,Mon Mar 30 2020,Mon Mar 30 2020,1,Planned Parenthood of California Central Coast,CA,355.0
Memphis,$109.27,US,Shelby County,Community Clinic,Thu Mar 26 2020,Thu Mar 26 2020,1,Planned Parenthood of Tennessee and North Mississippi,TN,25.0
Cincinnati,"$1,095.85",US,Hamilton County,Women's Health,Mon May 04 2020,Mon May 04 2020,1,Planned Parenthood Southwest Ohio Region Mt. Auburn Surgical Center,OH,115.0
Pocatello,"$1,095.85",US,Bannock County,Free Clinic,Mon May 04 2020,Mon May 04 2020,1,Pocatello Free Clinic,ID,210.0
Santa Rosa Beach,$109.02,US,Walton County,Free Clinic,Thu Mar 26 2020,Thu Mar 26 2020,1,Point Washington Medical Clinic,FL,25.0
Ontario,$253.07,US,San Bernardino County,Unknown,Thu Mar 26 2020,Tue Apr 28 2020,2,Pomona Community Health Center Ontario,CA,88.0
Ponce,"$27,742.41",US,,Free Clinic,Fri Apr 17 2020,Fri Apr 17 2020,1,Ponce Medical School Foundation Inc,PR,73.0
Portland,$109.27,US,Cumberland County,Free Clinic,Tue Mar 24 2020,Tue Mar 24 2020,1,Portland Community Free Clinic,ME,25.0
Portland,$109.26,US,Cumberland County,FQHC/Look-Alike,Tue Mar 24 2020,Tue Mar 24 2020,1,Portland Community Health Center,ME,25.0
Springfield,$109.27,US,Windsor County,Free Clinic,Thu Mar 26 2020,Thu Mar 26 2020,1,Precision Valley Free Clinic,VT,25.0
Dade City,$109.27,US,Pasco County,FQHC/Look-Alike,Thu Mar 26 2020,Thu Mar 26 2020,1,Premier Community HealthCare Administrative Office,FL,25.0
Grafton,$109.01,US,Taylor County,FQHC/Look-Alike,Thu Mar 26 2020,Thu Mar 26 2020,1,Preston-Taylor Community Health Centers,WV,25.0
Oakland,"$4,080.12",US,Alameda County,Community Clinic,Thu Mar 26 2020,Mon May 04 2020,3,"Primary Care at Home, Inc.",CA,154.0
Jackson Heights,"$1,205.11",US,Queens County,Community Clinic,Tue Mar 24 2020,Mon May 04 2020,2,Primary Care Medical Practice of NY Vida Sana Medical Care,NY,235.0
Blakely,$109.26,US,,FQHC/Look-Alike,Tue Mar 24 2020,Tue Mar 24 2020,1,Primary Care of Southwest Georgia,GA,25.0
Sharon,$109.27,US,Mercer County,FQHC/Look-Alike,Tue Mar 24 2020,Tue Mar 24 2020,1,Primary Health Network,PA,25.0
Monroe,$109.01,US,Ouachita Parish,FQHC/Look-Alike,Wed Apr 08 2020,Wed Apr 08 2020,1,Primary Health Services Center,LA,25.0
Monroe,"$5,750.00",US,Ouachita Parish,FQHC/Look-Alike,Mon May 04 2020,Mon May 04 2020,1,Primary Health Services Center,LA,14.0
Rossville,"$1,204.87",US,Walker County,FQHC/Look-Alike,Thu Mar 26 2020,Mon May 04 2020,2,Primary Healthcare Center Rossville,GA,235.0
Pittsburgh,$109.26,US,Allegheny County,Free Clinic,Tue Mar 24 2020,Tue Mar 24 2020,1,Program for Health Care to Underserved Populations Birmingham Free Clinic,PA,25.0
Rio Piedras,$109.01,US,,Public Health Department,Fri Apr 03 2020,Fri Apr 03 2020,1,Programa de Vacunacion Puerto Rico Department of Health Centro de Distribucion,PR,25.0
Camden,$633.61,US,Camden County,FQHC/Look-Alike,Tue Mar 24 2020,Tue Apr 28 2020,2,"Project H.O.P.E.,Inc.",NJ,186.0
Sumterville,$109.02,US,Sumter County,FQHC/Look-Alike,Thu Mar 26 2020,Thu Mar 26 2020,1,"Project Health, Inc. dba Langley Health Services",FL,25.0
New York,$109.03,US,New York County,FQHC/Look-Alike,Thu Apr 02 2020,Thu Apr 02 2020,1,Project Renewal Inc.,NY,25.0
Des Moines,$109.26,US,Polk County,FQHC/Look-Alike,Tue Mar 24 2020,Tue Mar 24 2020,1,"Proteus, Inc.",IA,25.0
Mesa,$109.02,US,Maricopa County,Community Clinic,Thu Mar 26 2020,Thu Mar 26 2020,1,"Prototype Health, Inc.",AZ,25.0
Everett,"$106,459.65",US,Snohomish County,Hospital,Tue Mar 17 2020,Fri Mar 27 2020,2,Providence Regional Medical Center Everett Colby,WA,2575.0
Santa Monica,$680.04,US,Los Angeles County,Unknown,Sat Mar 21 2020,Sat Mar 21 2020,1,Providence Saint John's Health Center,CA,164.0
Ciales,$109.02,US,,FQHC/Look-Alike,Thu Mar 26 2020,Thu Mar 26 2020,1,"PryMed Medical Care, Inc.",PR,25.0
Pueblo,$109.27,US,Pueblo County,FQHC/Look-Alike,Tue Mar 24 2020,Tue Mar 24 2020,1,Pueblo Community Health Center PCHC Pharmacy,CO,25.0
San Juan,"$5,110.81",US,,Public Health Department,Wed Apr 08 2020,Wed Apr 08 2020,1,Puerto Rico Department of Health,PR,8045.0
San Juan,$109.03,US,,Other,Fri Apr 03 2020,Fri Apr 03 2020,1,Puerto Rico State Guard National Guard,PR,24.0
San Juan,"$4,865.70",US,San Juan,Unknown,Fri May 01 2020,Fri May 01 2020,1,Puerto Rico Trauma Center,PR,308.0
Clayton,"$1,205.12",US,Pushmataha County,FQHC/Look-Alike,Tue Mar 24 2020,Tue May 05 2020,2,Pushmataha Family Medical Center Inc.,OK,235.0
Los Angeles,$109.27,US,Los Angeles County,FQHC/Look-Alike,Thu Mar 26 2020,Thu Mar 26 2020,1,QueensCare East 3rd Street,CA,25.0
Los Angeles,$810.05,US,Los Angeles County,FQHC/Look-Alike,Wed Apr 01 2020,Mon Apr 27 2020,2,QueensCare Health Center,CA,251.0
Los Angeles,"$5,750.00",US,Los Angeles County,FQHC/Look-Alike,Tue Apr 21 2020,Tue Apr 21 2020,1,QueensCare Hollywood,CA,14.0
Compton,$633.35,US,Los Angeles County,FQHC/Look-Alike,Thu Mar 26 2020,Fri Apr 24 2020,2,R.O.A.D.S. Community Care Clinic,CA,25.0
Temple,"$1,205.11",US,Carroll County,Community Clinic,Tue Mar 24 2020,Tue May 05 2020,2,Rapha Clinic of West Georgia,GA,235.0
Alexandria,$109.02,US,Rapides Parish,FQHC/Look-Alike,Thu Mar 26 2020,Thu Mar 26 2020,1,Rapides Primary Health Care Center,LA,25.0
Decatur,$109.02,US,Dekalb County,FQHC/Look-Alike,Mon Apr 27 2020,Mon Apr 27 2020,1,"Recovery Consultants of Atlanta, Inc.",GA,25.0
Redway,"$1,357.83",US,Humboldt County,FQHC/Look-Alike,Mon Mar 09 2020,Mon May 04 2020,3,Redwoods Rural Health Center Inc.,CA,303.0
Amarillo,$109.27,US,Potter County,FQHC/Look-Alike,Tue Mar 24 2020,Tue Mar 24 2020,1,Regence Health Network Homeless Clinic,TX,25.0
Lubec,$109.02,US,Washington County,FQHC/Look-Alike,Thu Mar 26 2020,Thu Mar 26 2020,1,Regional Medical Center at Lubec,ME,25.0
Allegan,$109.26,US,Allegan County,Free Clinic,Tue Mar 24 2020,Tue Mar 24 2020,1,Renewed Hope Health Clinic,MI,25.0
Roanoke,"$1,205.12",US,Roanoke City,Free Clinic,Tue Mar 24 2020,Tue May 05 2020,2,"Rescue Mission Ministries, Inc.",VA,235.0
Hampton,$109.02,US,Hampton City,Free Clinic,Thu Mar 26 2020,Thu Mar 26 2020,1,Richard F. Clarke Help Free Clinic Pharmacy,VA,25.0
Richmond,"$1,204.87",US,Richmond City,Free Clinic,Thu Mar 26 2020,Mon May 04 2020,2,Richmond Area High Blood Pressure Center for Healthy Hearts,VA,140.0
Ridgefield,"$2,176.09",US,Fairfield County,Unknown,Tue Apr 14 2020,Tue Apr 14 2020,1,Ridgefield Fire Department,CT,824.0
Santa Barbara,$109.03,US,Santa Barbara County,Community Clinic,Wed Apr 08 2020,Wed Apr 08 2020,1,Ridley-Tree Cancer Center,CA,25.0
San Rafael,$253.32,US,Marin County,FQHC/Look-Alike,Tue Mar 24 2020,Fri Apr 24 2020,2,Ritter Center,CA,90.0
Clinton,$109.26,US,East Feliciana Parish,FQHC/Look-Alike,Tue Mar 24 2020,Tue Mar 24 2020,1,RKM Primary Care,LA,25.0
Spencer,$109.27,US,Roane County,FQHC/Look-Alike,Tue Mar 24 2020,Tue Mar 24 2020,1,Roane County Family Health Care,WV,25.0
Ahoskie,$109.02,US,Hertford County,FQHC/Look-Alike,Thu Apr 16 2020,Thu Apr 16 2020,1,Roanoke Chowan Community Health Center,NC,25.0
Pembroke,$109.27,US,Robeson County,FQHC/Look-Alike,Thu Mar 26 2020,Thu Mar 26 2020,1,Robeson Health Care Corporation,NC,25.0
Rochester,"$4,244.13",US,Monroe County,Hospital,Tue Mar 24 2020,Thu Mar 26 2020,2,Rochester General Hospital,NY,931.0
Milner,"$1,205.11",US,Lamar County,Free Clinic,Tue Mar 24 2020,Mon May 04 2020,2,Rock Springs Clinic,GA,140.0
Springfield,$109.01,US,Clark County,FQHC/Look-Alike,Mon Apr 06 2020,Mon Apr 06 2020,1,Rocking Horse Community Health Center,OH,25.0
Rolla,"$1,095.85",US,Rolette County,Public Health Department,Mon May 04 2020,Mon May 04 2020,1,Rolette County Public Health District,ND,115.0
Oakland,$429.00,US,Alameda County,Community Clinic,Mon Mar 30 2020,Mon Mar 30 2020,1,Roots Community Health Center,CA,18.0
Seneca,$109.26,US,Oconee County,FQHC/Look-Alike,Tue Mar 24 2020,Tue Mar 24 2020,1,Rosa Clark Medical Clinic,SC,25.0
Gilroy,$144.05,US,Santa Clara County,Free Clinic,Fri Apr 24 2020,Fri Apr 24 2020,1,"RotaCare Gilroy Clinic at South Valley Middle School RotaCare Bay Area, Inc.",CA,65.0
Seattle,$109.02,US,King County,Community Clinic,Fri Mar 27 2020,Fri Mar 27 2020,1,Rotacare North Helpline,WA,25.0
San Jose,$3.29,US,Santa Clara County,Free Clinic,Thu Feb 13 2020,Thu Feb 13 2020,1,"RotaCare San Jose at Washington Elementary School RotaCare Bay Area, Inc.",CA,2.0
Uniondale,$109.02,US,Nassau County,Free Clinic,Fri Mar 27 2020,Fri Mar 27 2020,1,"RotaCare, Inc.",NY,25.0
West Plains,"$1,204.88",US,Howell County,FQHC/Look-Alike,Mon Apr 06 2020,Mon May 04 2020,2,Rural Alliance for Better Health aka Missouri Community Health Center,MO,235.0
Newport,$109.28,US,Cocke County,FQHC/Look-Alike,Tue Mar 24 2020,Tue Mar 24 2020,1,"Rural Medical Service, Inc. Newport",TN,25.0
Granbury,$109.26,US,Hood County,Free Clinic,Tue Mar 24 2020,Tue Mar 24 2020,1,Ruth's Place Clinic,TX,25.0
Rutland,"$1,205.11",US,Rutland County,Free Clinic,Tue Mar 24 2020,Tue May 05 2020,2,Rutland Free Clinic,VT,235.0
South Plainfield,"$293,484.51",US,Middlesex County,Unknown,Thu Apr 09 2020,Fri Apr 10 2020,12,RWJBarnabas Health Qualitas Pharmacy Services,NJ,766.0
New York,"$1,204.88",US,New York County,FQHC/Look-Alike,Sat Apr 04 2020,Mon May 04 2020,2,Ryan Chelsea-Clinton Community Health Center,NY,140.0
Los Angeles,"$3,539.14",US,Los Angeles County,Free Clinic,Wed Jan 29 2020,Fri Apr 24 2020,5,Saban Community Clinic,CA,191.0
Sacramento,$857.24,US,Sacramento County,FQHC/Look-Alike,Fri Mar 13 2020,Thu Mar 26 2020,2,Sacramento Native American Health Center,CA,132.0
Round Rock,$253.32,US,Williamson County,Community Clinic,Thu Mar 26 2020,Mon Apr 27 2020,2,Sacred Heart Community Clinic,TX,90.0
Stanwood,$109.02,US,Snohomish County,Free Clinic,Thu Mar 26 2020,Thu Mar 26 2020,1,Safe Harbor Free Clinic,WA,25.0
Sacramento,$575.00,US,Sacramento County,Social Services,Tue Apr 21 2020,Tue Apr 21 2020,1,Safer Alternatives Thru Networking & Education (SANE) - Clinic Site,CA,13.0
Waukesha,$109.27,US,Waukesha County,Free Clinic,Tue Mar 24 2020,Tue Mar 24 2020,1,Saint Joseph's Medical Clinic,WI,25.0
Cleveland,$109.27,US,Cuyahoga County,Free Clinic,Tue Mar 24 2020,Tue Mar 24 2020,1,Salaam Clinic,OH,25.0
Salina,$109.03,US,Saline County,FQHC/Look-Alike,Mon Apr 06 2020,Mon Apr 06 2020,1,Salina Family Healthcare Center,KS,25.0
Saltville,$109.27,US,Smyth County,FQHC/Look-Alike,Tue Mar 24 2020,Tue Mar 24 2020,1,Saltville Medical Center,VA,25.0
Freedom,"$124,112.50",US,Santa Cruz County,Free Clinic,Wed Apr 15 2020,Wed Apr 15 2020,1,Salud at Valle Verde,CA,539.0
Fort Lupton,$109.27,US,Weld County,FQHC/Look-Alike,Thu Mar 26 2020,Thu Mar 26 2020,1,Salud Family Health Centers Administration,CO,25.0
Naranjito,"$1,204.87",US,,FQHC/Look-Alike,Thu Mar 26 2020,Tue May 05 2020,2,Salud Integral en la Montaña (SIM) - Central Offices,PR,235.0
Cedar Park,$157.16,US,Williamson County,Community Clinic,Thu Mar 26 2020,Fri Apr 24 2020,2,Samaritan Health Services,TX,90.0
San Mateo,$633.35,US,San Mateo County,Free Clinic,Thu Mar 26 2020,Fri Apr 24 2020,2,Samaritan House Free Clinic,CA,189.0
Cape Girardeau,$109.02,US,Cape Girardeau County,Free Clinic,Thu Mar 26 2020,Thu Mar 26 2020,1,Samaritan Regional Health Clinic,MO,25.0
Valencia,$109.27,US,Los Angeles County,FQHC/Look-Alike,Tue Mar 24 2020,Tue Mar 24 2020,1,Samuel Dixon Family Health Center,CA,25.0
Canyon Country,"$1,150.00",US,Los Angeles County,FQHC/Look-Alike,Wed Apr 22 2020,Wed Apr 22 2020,1,Samuel Dixon Family Health Center Canyon Country,CA,19.0
Newhall,"$1,150.00",US,Los Angeles County,FQHC/Look-Alike,Wed Apr 22 2020,Wed Apr 22 2020,1,Samuel Dixon Family Health Center Newhall,CA,19.0
Val Verde,"$1,150.00",US,Los Angeles County,FQHC/Look-Alike,Wed Apr 22 2020,Wed Apr 22 2020,1,Samuel Dixon Family Health Center Val Verde,CA,19.0
San Diego,$109.27,US,San Diego County,FQHC/Look-Alike,Tue Mar 24 2020,Tue Mar 24 2020,1,San Diego Family Care Mid-City Community Clinic (Pediatrics),CA,25.0
San Fernando,"$1,204.87",US,Los Angeles County,FQHC/Look-Alike,Fri Mar 27 2020,Mon May 04 2020,2,San Fernando Community Health Center,CA,140.0
San Francisco,$48.56,US,San Francisco County,FQHC/Look-Alike,Mon Mar 23 2020,Mon Mar 23 2020,1,San Francisco Community Clinic Consortium Street Outreach Services,CA,2.0
San Francisco,$109.27,US,San Francisco County,Free Clinic,Tue Mar 24 2020,Tue Mar 24 2020,1,San Francisco Free Clinic,CA,25.0
Houston,"$5,750.00",US,Harris County,Charitable Pharmacy,Wed Apr 29 2020,Wed Apr 29 2020,1,San Jose Clinic,TX,14.0
San Jose,$765.04,US,Santa Clara County,FQHC/Look-Alike,Wed Feb 05 2020,Wed Feb 05 2020,1,San Jose Foothill Family Community Clinic - Administration,CA,135.0
San Leandro,"$26,650.41",US,Alameda County,Nonprofit Hospital,Fri Apr 10 2020,Fri Apr 10 2020,1,San Leandro Hospital Inpatient Pharmacy Department,CA,70.0
South San Francisco,$830.61,US,San Mateo County,Unknown,Thu Mar 19 2020,Thu Mar 19 2020,1,San Mateo County Public Health SMC Warehouse,CA,257.0
San Diego,"$3,960.83",US,San Diego County,FQHC/Look-Alike,Fri Mar 13 2020,Wed Apr 15 2020,2,San Ysidro Health,CA,649.0
Santa Barbara,"$6,835.90",US,Santa Barbara County,Unknown,Wed Mar 11 2020,Thu Apr 16 2020,3,Sansum Clinic,CA,1009.0
Santa Barbara,"$535,574.32",US,Santa Barbara County,Hospital,Fri Mar 20 2020,Thu Apr 09 2020,22,Santa Barbara Cottage Hospital,CA,501.0
Santa Barbara,"$6,572.83",US,Santa Barbara County,Unknown,Wed Apr 01 2020,Wed Apr 01 2020,1,Santa Barbara County Fire Department,CA,1323.0
Santa Barbara,"$2,062.89",US,Santa Barbara County,Other,Tue Apr 14 2020,Tue Apr 14 2020,1,"Santa Barbara County Search & Rescue, Inc.",CA,
